{
  "$schema": "https://json-schema.org/draft/2020-12/schema",
  "type": "object",
  "additionalProperties": false,
  "required": [
    "schema",
    "schemaVersion",
    "contractStatus",
    "artifactType",
    "artifactKey",
    "entityCode",
    "plane",
    "dependencies",
    "artifactHash"
  ],
  "properties": {
    "accessAuthority": {},
    "additionalCoreRefs": {},
    "artifactHash": {},
    "artifactKey": {},
    "artifactType": {
      "const": "presentation_section"
    },
    "authorization": {},
    "availableOperations": {},
    "childCollections": {},
    "completenessEvaluation": {},
    "completenessPacks": {},
    "contentModel": {},
    "contractStatus": {},
    "coreRef": {},
    "dataBinding": {},
    "dependencies": {},
    "entityCode": {},
    "fieldBindingNamespace": {},
    "fieldBindings": {},
    "form": {},
    "linkFields": {},
    "load": {},
    "ownerBinding": {},
    "pagination": {},
    "plane": {
      "const": "neon"
    },
    "relationKey": {},
    "rendererKey": {},
    "requiredContext": {},
    "resourceStates": {},
    "schema": {},
    "schemaVersion": {
      "const": 2
    },
    "sectionKey": {},
    "targetCoreRef": {},
    "targetFieldBindings": {},
    "validationAuthority": {}
  }
}
