{
  "schema": "athyper.compiled-entity-artifact/2.0-draft",
  "schemaVersion": 2,
  "contractStatus": "draft_for_review",
  "artifactType": "presentation_section",
  "artifactKey": "business_partner/presentation.section.identifiers-tax",
  "entityCode": "business_partner_identifier",
  "plane": "neon",
  "sectionKey": "identifiers-tax",
  "rendererKey": "platform.related-collection.v1",
  "dataBinding": {
    "kind": "registered_service",
    "handlerKey": "neon.bp.section.identifiers-tax.v1",
    "existingRoutes": [
      "/api/neon/business-partners/:id/360/identifiers"
    ],
    "ownerEntityCode": "business_partner",
    "scopeAuthority": "server",
    "includeInAggregate": false
  },
  "coreRef": "business_partner_identifier/core.json",
  "fieldBindings": [],
  "authorization": {
    "viewPermission": "neon.relationship.business_partner_identifier.read_masked",
    "fieldPermissions": [
      "neon.relationship.business_partner_tax.read_masked"
    ],
    "discoverableWhenDenied": false,
    "enforceBeforeDataQuery": true
  },
  "resourceStates": [
    "loading",
    "error",
    "empty",
    "restricted",
    "ready"
  ],
  "pagination": {
    "defaultLimit": 25,
    "maxLimit": 100
  },
  "load": "on_visible",
  "requiredContext": "resolve_from_target_core",
  "dependencies": [
    "business_partner_identifier/core",
    "business_partner_tax_registration/core",
    "business_partner_tax_registration/operation"
  ],
  "additionalCoreRefs": [
    "business_partner_tax_registration/core.json"
  ],
  "artifactHash": "sha256:5f1c24c061e953ef90865db14097dff5257c498adc5ffb9e993174a300361701",
  "childCollections": [
    {
      "key": "identifiers",
      "entityCode": "business_partner_identifier",
      "coreRef": "business_partner_identifier/core.json",
      "rendererKey": "platform.related-collection.v1",
      "fieldBindings": [
        {
          "fieldKey": "identifier_value"
        }
      ],
      "load": "on_visible",
      "sensitiveFieldHandling": "masked_by_default_with_explicit_operation"
    },
    {
      "key": "tax_registrations",
      "entityCode": "business_partner_tax_registration",
      "coreRef": "business_partner_tax_registration/core.json",
      "rendererKey": "platform.related-collection.v1",
      "fieldBindings": [
        {
          "fieldKey": "registration_type_code"
        },
        {
          "fieldKey": "registration_number"
        },
        {
          "fieldKey": "effective_from"
        },
        {
          "fieldKey": "effective_until"
        }
      ],
      "load": "on_visible",
      "operationRef": "business_partner_tax_registration/operation.json",
      "sensitiveFieldHandling": "masked_by_default_with_explicit_operation"
    }
  ]
}
