{
  "schema": "athyper.compiled-entity-artifact/2.0-draft",
  "schemaVersion": 2,
  "contractStatus": "draft_for_review",
  "artifactType": "presentation_section",
  "artifactKey": "business_partner/presentation.section.identity",
  "entityCode": "business_partner",
  "plane": "neon",
  "sectionKey": "identity",
  "rendererKey": "platform.fields.v1",
  "dataBinding": {
    "kind": "registered_service",
    "handlerKey": "neon.bp.section.identity.v1",
    "existingRoutes": [
      "/api/neon/business-partners/:id/360/identity"
    ],
    "ownerEntityCode": "business_partner",
    "scopeAuthority": "server",
    "includeInAggregate": false
  },
  "coreRef": "business_partner/core.json",
  "fieldBindings": [
    {
      "fieldKey": "legal_name"
    },
    {
      "fieldKey": "legal_form_label"
    },
    {
      "fieldKey": "registration_country_code"
    },
    {
      "fieldKey": "incorporation_date"
    },
    {
      "fieldKey": "business_type_label"
    },
    {
      "fieldKey": "founded_year"
    },
    {
      "fieldKey": "employee_count"
    },
    {
      "fieldKey": "employee_count_as_of"
    },
    {
      "fieldKey": "employee_count_scope"
    },
    {
      "fieldKey": "person_code"
    },
    {
      "fieldKey": "person_first_name"
    },
    {
      "fieldKey": "person_middle_name"
    },
    {
      "fieldKey": "person_last_name"
    },
    {
      "fieldKey": "person_preferred_name"
    }
  ],
  "authorization": {
    "viewPermission": "neon.relationship.business_partner_identity.read",
    "fieldPermissions": [],
    "discoverableWhenDenied": false,
    "enforceBeforeDataQuery": true
  },
  "resourceStates": [
    "loading",
    "error",
    "empty",
    "restricted",
    "ready"
  ],
  "pagination": {
    "defaultLimit": 25,
    "maxLimit": 100
  },
  "load": "on_visible",
  "requiredContext": "resolve_from_target_core",
  "dependencies": [
    "business_partner/core",
    "business_partner_alias/core",
    "business_partner_alias/operation"
  ],
  "childCollections": [
    {
      "key": "aliases",
      "entityCode": "business_partner_alias",
      "coreRef": "business_partner_alias/core.json",
      "rendererKey": "platform.related-collection.v1",
      "fieldBindings": [
        {
          "fieldKey": "alias_kind"
        },
        {
          "fieldKey": "alias_name"
        },
        {
          "fieldKey": "language_code"
        },
        {
          "fieldKey": "country_code"
        },
        {
          "fieldKey": "is_primary"
        },
        {
          "fieldKey": "effective_from"
        },
        {
          "fieldKey": "effective_until"
        }
      ],
      "load": "on_visible",
      "operationRef": "business_partner_alias/operation.json",
      "emptyState": {
        "title": "No alternate names",
        "detail": "Effective legal, trading, former, and search names appear here."
      }
    }
  ],
  "artifactHash": "sha256:94abd6e7b6a5805caba03246310902a5ed20f19c8df60a6fb109f938f4d5b16b"
}
