{
  "schema": "athyper.compiled-entity-artifact/2.0-draft",
  "schemaVersion": 2,
  "contractStatus": "draft_for_review",
  "artifactType": "presentation_section",
  "artifactKey": "business_partner/presentation.section.comments",
  "entityCode": "business_partner",
  "plane": "neon",
  "sectionKey": "comments",
  "rendererKey": "platform.comments.v1",
  "dataBinding": {
    "serviceKey": "platform.comments.v1",
    "ownerEntityCode": "business_partner",
    "includeInAggregate": false
  },
  "authorization": {
    "viewPermission": "neon.collaboration.comment.read",
    "permissionStatus": "proposed_requires_catalog_verification",
    "discoverableWhenDenied": false,
    "enforceBeforeDataQuery": true
  },
  "load": "on_visible",
  "resourceStates": [
    "loading",
    "error",
    "empty",
    "restricted",
    "ready"
  ],
  "pagination": {
    "defaultLimit": 25,
    "maxLimit": 100
  },
  "dependencies": [
    "business_partner/core"
  ],
  "artifactHash": "sha256:38d6ffff4726ed40e39eb1ff87a914fadd6cb75d29e592fb565fd2bd24c73ac0",
  "availableOperations": [
    {
      "key": "create",
      "permissionCode": "neon.collaboration.comment.create",
      "permissionStatus": "proposed_requires_catalog_verification",
      "execution": {
        "handlerKey": "platform.comments.create.v1",
        "registryRequired": true
      },
      "owner": "platform_service"
    },
    {
      "key": "update_own",
      "permissionCode": "neon.collaboration.comment.update_own",
      "permissionStatus": "proposed_requires_catalog_verification",
      "execution": {
        "handlerKey": "platform.comments.update_own.v1",
        "registryRequired": true
      },
      "owner": "platform_service"
    },
    {
      "key": "archive_own",
      "permissionCode": "neon.collaboration.comment.archive_own",
      "permissionStatus": "proposed_requires_catalog_verification",
      "execution": {
        "handlerKey": "platform.comments.archive_own.v1",
        "registryRequired": true
      },
      "owner": "platform_service"
    }
  ]
}
