{
  "schema": "athyper.compiled-entity-artifact/2.0-draft",
  "schemaVersion": 2,
  "contractStatus": "draft_for_review",
  "artifactType": "presentation_section",
  "artifactKey": "business_partner/presentation.section.attachments",
  "entityCode": "business_partner",
  "plane": "neon",
  "sectionKey": "attachments",
  "rendererKey": "platform.attachments.v1",
  "dataBinding": {
    "serviceKey": "platform.attachments.v1",
    "ownerEntityCode": "business_partner",
    "includeInAggregate": false
  },
  "authorization": {
    "viewPermission": "neon.collaboration.attachment.read",
    "permissionStatus": "proposed_requires_catalog_verification",
    "discoverableWhenDenied": false,
    "enforceBeforeDataQuery": true
  },
  "load": "on_visible",
  "resourceStates": [
    "loading",
    "error",
    "empty",
    "restricted",
    "ready"
  ],
  "pagination": {
    "defaultLimit": 25,
    "maxLimit": 100
  },
  "dependencies": [
    "business_partner/core"
  ],
  "artifactHash": "sha256:e91747fa94ebdaff6d4d5e9fb9301b270abf08d800a9ca39dc430e1bcf857e1e",
  "availableOperations": [
    {
      "key": "create",
      "permissionCode": "neon.collaboration.attachment.create",
      "permissionStatus": "proposed_requires_catalog_verification",
      "execution": {
        "handlerKey": "platform.attachments.create.v1",
        "registryRequired": true
      },
      "owner": "platform_service"
    },
    {
      "key": "finalize",
      "permissionCode": "neon.collaboration.attachment.finalize",
      "permissionStatus": "proposed_requires_catalog_verification",
      "execution": {
        "handlerKey": "platform.attachments.finalize.v1",
        "registryRequired": true
      },
      "owner": "platform_service"
    },
    {
      "key": "download",
      "permissionCode": "neon.collaboration.attachment.download",
      "permissionStatus": "proposed_requires_catalog_verification",
      "execution": {
        "handlerKey": "platform.attachments.download.v1",
        "registryRequired": true
      },
      "owner": "platform_service"
    },
    {
      "key": "archive",
      "permissionCode": "neon.collaboration.attachment.archive",
      "permissionStatus": "proposed_requires_catalog_verification",
      "execution": {
        "handlerKey": "platform.attachments.archive.v1",
        "registryRequired": true
      },
      "owner": "platform_service"
    }
  ]
}
