{
  "schema": "athyper.compiled-entity-artifact/2.0-draft",
  "schemaVersion": 2,
  "contractStatus": "draft_for_review",
  "artifactType": "presentation_section",
  "artifactKey": "business_partner/presentation.section.requests",
  "entityCode": "business_partner_request",
  "plane": "neon",
  "sectionKey": "requests",
  "rendererKey": "platform.related-collection.v1",
  "dataBinding": {
    "kind": "registered_service",
    "handlerKey": "neon.bp.section.requests.v1",
    "existingRoutes": [
      "/api/neon/business-partners/:id/360/requests"
    ],
    "ownerEntityCode": "business_partner",
    "scopeAuthority": "server",
    "includeInAggregate": false
  },
  "coreRef": "business_partner_request/core.json",
  "fieldBindings": [
    {
      "fieldKey": "request_no"
    },
    {
      "fieldKey": "request_kind"
    },
    {
      "fieldKey": "status"
    },
    {
      "fieldKey": "target_business_partner_id"
    }
  ],
  "authorization": {
    "viewPermission": "neon.relationship.entity_case.read",
    "fieldPermissions": [],
    "discoverableWhenDenied": false,
    "enforceBeforeDataQuery": true
  },
  "resourceStates": [
    "loading",
    "error",
    "empty",
    "restricted",
    "ready"
  ],
  "pagination": {
    "defaultLimit": 25,
    "maxLimit": 100
  },
  "load": "on_visible",
  "requiredContext": "resolve_from_target_core",
  "dependencies": [
    "business_partner_request/core"
  ],
  "artifactHash": "sha256:b956aaded32a71271de6add42b3089d2455b8454fa98e8e8694ca1871a85fecb"
}
